{
  "$schema": "https://raw.githubusercontent.com/rfontes1987/wilanis-js/schemas-v1/packages/core/schemas/plugin.schema.json",
  "label": "HTTP",
  "description": "HTTP out, HTTP connections, HTTP triggers, body codecs. Settings say which codec handles which content type; a content type mapped to the blob codec is stored as a file and carried as a handle. Who may call a route is not this plugin's business: a trigger attaches its policies and gives the guard the token where the route reads it (a header, a cookie), and the guarding plugin (@wilanis/plugin-auth) identifies the caller.",
  "settings": {
    "fields": {
      "port": {
        "type": "number",
        "required": false,
        "description": "listen port, default 8080"
      },
      "codecs": {
        "type": {
          "fields": {},
          "open": "string"
        },
        "description": "content type -> codec document path, e.g. \"application/json\": \"@http/codecs/json.codec.json\""
      }
    }
  },
  "grants": {
    "ports": [
      "@http/http.port.json",
      "@http/server.port.json"
    ],
    "triggerKinds": [
      "@http/http.trigger-kind.json"
    ],
    "connectionKinds": [
      "@http/http.connection-kind.json"
    ],
    "codecs": [
      "@http/codecs/json.codec.json",
      "@http/codecs/text.codec.json",
      "@http/codecs/form.codec.json",
      "@http/codecs/multipart.codec.json",
      "@http/codecs/blob.codec.json"
    ],
    "shapes": [
      "@http/Cookie.shape.json"
    ]
  }
}
